{
  "schema_version": "task-bundle.v0",
  "task_id": "deep-search-reward-task",
  "prompt": "Why do deep search agents need evidence-sensitive rewards beyond outcome-only task success?",
  "reference_answer": "Deep search agents need evidence-sensitive rewards because long-horizon search involves many steps and tool calls, so binary success signals are too sparse and can reward shallow shortcuts. ASearcher shows that search can go far beyond ten turns and over 100 tool calls, while DeepDive combines knowledge-graph data synthesis with multi-turn RL for hard search. CaRR directly argues that binary outcome reward misses comprehensiveness and factuality, and introduces citation-aware rubric rewards to encourage evidence-grounded reasoning.",
  "documents": [
    {
      "doc_id": "d1",
      "title": "ASearcher digest",
      "url": "https://arxiv.org/abs/2508.07976",
      "content": "ASearcher says long-horizon deep search can require many turns and tool calls, sometimes beyond one hundred, which makes outcome-only supervision sparse. The project scales asynchronous RL to long-horizon search so those longer trajectories become trainable.",
      "source_type": "paraphrased-snapshot"
    },
    {
      "doc_id": "d2",
      "title": "DeepDive digest",
      "url": "https://github.com/THUDM/DeepDive",
      "content": "DeepDive trains deep search agents with automated data synthesis from knowledge graphs and end-to-end multi-turn reinforcement learning. It explicitly targets complex multi-step information-seeking tasks and longer reasoning paths.",
      "source_type": "paraphrased-snapshot"
    },
    {
      "doc_id": "d3",
      "title": "CaRR digest",
      "url": "https://github.com/THUDM/CaRR",
      "content": "CaRR argues that binary outcome rewards for deep search agents miss comprehensiveness, factuality, and grounded reasoning quality. It introduces citation-aware rubric rewards and evidence-chain checks so the reward reflects citation grounding rather than only final correctness.",
      "source_type": "paraphrased-snapshot"
    }
  ],
  "required_claims": [
    {
      "claim_id": "c1",
      "text": "Long-horizon deep search creates sparse supervision because agents may need many turns and tool calls before success is visible.",
      "supported_by": ["d1", "d2"],
      "keywords": ["long-horizon", "many turns", "tool calls", "sparse"]
    },
    {
      "claim_id": "c2",
      "text": "Outcome-only reward misses whether the reasoning is comprehensive and factually grounded.",
      "supported_by": ["d3"],
      "keywords": ["outcome-only", "comprehensiveness", "factuality", "grounded"]
    },
    {
      "claim_id": "c3",
      "text": "Evidence-sensitive rewards such as citation-aware rubrics help reward citation grounding and evidence-chain quality rather than only final correctness.",
      "supported_by": ["d3"],
      "keywords": ["citation-aware", "citation grounding", "evidence-chain", "final correctness"],
      "depends_on": ["c1", "c2"]
    }
  ],
  "budget": {
    "max_steps": 8,
    "max_document_reads": 3
  }
}
